{
  "schema_version": "svetlost33-m0-index-2",
  "sequence": 3,
  "issued_at": "2026-09-18T10:35:15Z",
  "expires_at": "2027-02-01T00:00:00Z",
  "key_id": "svetlost33-content-2026-key-1",
  "channels": {
    "production": {
      "release_set_id": "shared-charity-2026-09-18-m0v2-s3",
      "path": "releases/shared-charity-2026-09-18-m0v2-s3/release-set.json",
      "bytes": 2328,
      "sha256": "34d98c1b975fda17e2e81daaf7bbcbcf180e1bc7c30c165b3c1b2578253cae45",
      "signature_path": "releases/shared-charity-2026-09-18-m0v2-s3/release-set.sig"
    }
  }
}
