{
  "schema_version": "svetlost33-m0-index-2",
  "sequence": 10,
  "issued_at": "2026-09-27T09:06:12Z",
  "expires_at": "2027-02-01T00:00:00Z",
  "key_id": "svetlost33-content-2026-key-1",
  "channels": {
    "production": {
      "release_set_id": "shared-calendar-browser-2026-09-27-m0v2-s10",
      "path": "releases/shared-calendar-browser-2026-09-27-m0v2-s10/release-set.json",
      "bytes": 3933,
      "sha256": "ccc354a8c9e2af4e45b08ec8ffc1d73dfeb4d8154dcf923efb5324d50debe879",
      "signature_path": "releases/shared-calendar-browser-2026-09-27-m0v2-s10/release-set.sig"
    }
  }
}
