{
  "schema_version": "svetlost33-m0-index-2",
  "sequence": 14,
  "issued_at": "2026-10-06T18:16:00Z",
  "expires_at": "2027-02-01T00:00:00Z",
  "key_id": "svetlost33-content-2026-key-1",
  "channels": {
    "production": {
      "release_set_id": "shared-calendar-gospel-2026-10-06-m0v2-s14",
      "path": "releases/shared-calendar-gospel-2026-10-06-m0v2-s14/release-set.json",
      "bytes": 3974,
      "sha256": "4e82e44fb0ef84fec3789ee009f4526cb57ac5e3d76162ca84b8ce5d378de097",
      "signature_path": "releases/shared-calendar-gospel-2026-10-06-m0v2-s14/release-set.sig"
    }
  }
}
