{
  "schema_version": "svetlost33-m0-index-2",
  "sequence": 100,
  "issued_at": "2026-10-06T00:00:00Z",
  "expires_at": "2026-10-07T00:00:00Z",
  "key_id": "ks01-test-transport-key-1",
  "channels": {
    "production": {
      "release_set_id": "test-ks01-baseline62-100",
      "path": "release-set.json",
      "bytes": 2680,
      "sha256": "53e6666344974d3b601374e3d47ff2aee1e442464c498fbafe4db102f42b78b5",
      "signature_path": "release-set.sig"
    }
  }
}
