{
  "schema_version": "svetlost33-m0-index-2",
  "sequence": 17,
  "issued_at": "2026-10-26T12:00:00Z",
  "expires_at": "2027-02-01T00:00:00Z",
  "key_id": "svetlost33-content-2026-key-1",
  "channels": {
    "production": {
      "release_set_id": "shared-gospel-2026-10-26-m0v2-s17",
      "path": "releases/shared-gospel-2026-10-26-m0v2-s17/release-set.json",
      "bytes": 3911,
      "sha256": "78783865bda27cafecd292f6a1a29553b4a40fbb621493da7466526e47e2fec8",
      "signature_path": "releases/shared-gospel-2026-10-26-m0v2-s17/release-set.sig"
    }
  }
}
