{
  "schema_version": "svetlost33-m0-index-2",
  "sequence": 9,
  "issued_at": "2026-09-21T05:37:09Z",
  "expires_at": "2027-02-01T00:00:00Z",
  "key_id": "svetlost33-content-2026-key-1",
  "channels": {
    "production": {
      "release_set_id": "shared-saints-completion-2026-09-21-m0v2-s9",
      "path": "releases/shared-saints-completion-2026-09-21-m0v2-s9/release-set.json",
      "bytes": 3401,
      "sha256": "d95c571945fe6ea8f93adf47623b3de2ec40220c5f54cd13785800f26815cdf0",
      "signature_path": "releases/shared-saints-completion-2026-09-21-m0v2-s9/release-set.sig"
    }
  }
}
