{
  "schema_version": "svetlost33-m0-index-2",
  "sequence": 102,
  "issued_at": "2026-10-06T00:00:00Z",
  "expires_at": "2026-10-07T00:00:00Z",
  "key_id": "ks01-test-transport-key-1",
  "channels": {
    "production": {
      "release_set_id": "test-ks01-synthetic104-102",
      "path": "release-set.json",
      "bytes": 2694,
      "sha256": "fe869511935ab741a6d84e692c72d7e74034f12adeaa022f4c11ddfc7b9b2be8",
      "signature_path": "release-set.sig"
    }
  }
}
