{
  "schema_version": "svetlost33-m0-index-2",
  "sequence": 101,
  "issued_at": "2026-10-06T00:00:00Z",
  "expires_at": "2026-10-07T00:00:00Z",
  "key_id": "ks01-test-transport-key-1",
  "channels": {
    "production": {
      "release_set_id": "test-ks01-packagea-101",
      "path": "release-set.json",
      "bytes": 2678,
      "sha256": "9c18a16271fa6e0bdbcddad8993103c1ec5b7c38c59344b77940e5ea13ba9ae2",
      "signature_path": "release-set.sig"
    }
  }
}
