{
  "schema_version": "svetlost33-m0-index-2",
  "sequence": 1,
  "issued_at": "2026-09-15T00:00:00Z",
  "expires_at": "2099-09-15T00:00:00Z",
  "key_id": "svetlost33-fixture-key-1",
  "channels": {
    "production": {
      "release_set_id": "fixture-release-2026-r1",
      "path": "release-set.json",
      "bytes": 1836,
      "sha256": "edac746fd4ad2ecfa91d3c41bb67429e7cec9106ea52a90380395fbec86ed507",
      "signature_path": "release-set.sig"
    }
  }
}
